Title,Original Title,Subtitle,Series,Volume,Author,"Author (Last, First)",Illustrator,Narrator,Translator,Editor,Publisher,Date Published,Year Published,Edition,Genre,Summary,Guided Reading Level,Lexile Measure,Grade Level Equivalent,Developmental Reading Assessment,Interest Level,Word Count,Number of Pages,Format,Dimensions,Weight,List Price,Language,DDC,LCC,OCLC,ISBN,Favorites,Rating,Physical Location,Status,Date Started,Date Finished,Loaned To,Date Loaned,Borrowed From,Date Borrowed,Returned from Borrow,Quantity,Condition,Recommended By,Date Added,Tags,Purchase Date,Purchase Place,Purchase Price,Notes,Google VolumeID,Category,Wish List,Uploaded Image URL,Activities
A Charlie Brown Christmas,,,,,Charles Schulz,"Schulz, Charles",,,,,"Frederic Thomas USA, Incorporated",2016/10/01,2016,,,A Charlie Brown Christmas Storybook Greetings,,,,,,,28,,,,,English,,,,9781945546013,0,0,,Unread,,,,,,,0,,,,2018/12/11 14:50:03.66357970,,,,,,_j8ivgAACAAJ,,0,,
Big Birthday,,,,,Kate Hosford,"Hosford, Kate",,,,,Carolrhoda Books,2012/04/01,2012,,Juvenile Fiction,Annabelle is determined to have a birthday party that stands out from the rest. The moon seems like the perfect spot! But wearing spacesuits and partying in a place with no air create some challenges that Annabelle didn't expect. Will her out-of-this-world birthday still be a blast?,,,,,,,32,,,,,English,,,,9780761387220,0,0,,Unread,,,,,,,0,,,,2018/12/11 14:50:39.468335986,,,,,,lKyVtLohNIcC,,0,,
Come Home Already!,,,,,Jory John,"John, Jory",,,,,HarperCollins,2017/12/05,2017,,Juvenile Fiction,"An Amazon Best Book of the Month for Kids * A Bank Street College of Education Best Children's Books of the YearFrom the creators of Goodnight Already! and I Love You Already!, the third hysterical picture book about Duck and Bear, unlikely pals. An excited Duck wants to hang out with Bear. But Bear’s gone fishing for a whole week and is happy to finally get a second alone. What will Duck do while Bear is gone? How will he survive without his best pal?!",,,,,,,32,,,,,English,,,,9780062370976,0,0,,Unread,,,,,,,0,,,,2018/12/11 14:49:32.195184946,,,,,,QBRWMQAACAAJ,,0,,
Curious George and the Firefighters,,,,,"H. A. Rey, Anna Grossnickle Hines","Rey, H. A.",,,,,Houghton Mifflin Harcourt,2010/05/03,2010,,Juvenile Fiction,"It’s the formula for success for preschoolers—Curious George and fire trucks! Curious George and the Firefighters is a story based on H. A. and Margret Rey’s popular primate and painted in the original watercolor and charcoal style. Firefighters are a famously brave lot, but can they withstand a visit from one curious monkey?",,,,,,,24,,,,,English,,,,9780547342184,0,0,,Unread,,,,,,,0,,,,2018/12/11 14:50:25.784039,,,,,,H_il7v-J-OIC,,0,,
Dora's Chilly Day,,,,,Kiki Thorpe,"Thorpe, Kiki",,,,,ABDO,2006/07/01,2006,,Juvenile Fiction,Dora and Boots try to find some chocolate for Abuela so that she can make her chilly day surprise.,,,,,,,24,,,,,English,,,,9781599612409,0,0,,Unread,,,,,,,0,,,,2018/12/18 14:37:43.129227042,,,,,,Vge9pRwrt3sC,,0,,
"Fancy Nancy: Bonjour, Butterfly",,,,,Jane O'Connor,"O'Connor, Jane",,,,,HarperCollins,2008/02/05,2008,,Juvenile Fiction,"Nancy thinks butterflies are simply exquisite. And that is why she can't wait for her friend Bree's Butterfly Birthday. It's going to be the fanciest birthday party ever! But when Nancy finds out she can't go because her grandparents' fiftieth anniversary party is the same day, she is furious. (Mad is way too plain for how she feels.) Will Nancy be able to overcome her disappointment?   In this magical new story from bestselling duo Jane O'Connor and Robin Preiss Glasser, everybody's favorite fancy girl gets a surprise lesson in fancy from her grandparents. Looks like fancy runs in the family after all!",,,,,,,32,,,,,English,,,,9780061235887,0,0,,Unread,,,,,,,0,,,,2018/12/18 14:36:52.160874962,,,,,,IZ1FtgEACAAJ,,0,https://covers.openlibrary.org/b/id/7229933-L.jpg,
Fraidyzoo,,,,,Thyra Heder,"Heder, Thyra",,,,,Harry N. Abrams,2013/11/05,2013,,Juvenile Fiction,"It’s a great day to go to the zoo! As her family hustles to get out the door, Little T lags behind. She’s afraid to go back to the zoo; the only trouble is, she can’t remember why. As an ingenious solution to help her remember, her mom, dad, and sister construct homemade costumes and act out zoo animals—in alphabetical order, no less! The costumes and scenes grow increasingly elaborate and breathtakingly creative. An umbrella and bubble wrap magically transform into a jellyfish, bath towels and a can of soda become a parrot, and many, many more. At the end of the day, Little T has conquered her fear and no longer feels like a “fraidyzoo.” In this charming, witty picture book debut, Thyra Heder honors the bravery it takes to face your fears, and the loving people who help you do so.   Praise for Fraidyzoo STARRED REVIEWS ""WARNING: Expect riotous buffoonery after reading this clever and original alphabet story, as kids will definitely want to “parrot” the examples."" —Kirkus Reviews, starred review  ""Debut talent Heder comes up with a wildly imaginative idea for an alphabet book/animal guessing game, elaborates it with smartly drafted ink-and-watercolor spreads, and seasons it with plenty of family warmth and hullaballoo."" —Publishers Weekly, starred review  ""The cut-and-paste, handmade look and feel of this picture book underscores its thematic ode to creative problem solving... The charming, detailed watercolor and ink illustrations really tell the story, and children will relish poring over them to guess the animal costumes and identify their construction materials."" —School Library Journal  ""Heder tells a child-relevant story about facing your fears with a light hand and zippy prose, but it’s her art that dials the zippiness up to 11, as her warm and humorously realistic figures gallivant alongside some remarkably envisioned handcrafted animal puppets."" —Booklist  ""This book does the impossible, taking one of the oldest children’s book conventions, the zoo alphabet, and completely reinventing it.  It’s a story about a family helping one of their own overcome fear by being utterly silly and completely loving.  The whole thing is done with such a confident and lively style, it’s hard to believe that this is Heder’s first picture book. Fraidyzoo is funny, original, and announces Heder as a force to be reckoned with."" —The Atlantic Wire  ""Illustrations capture the empathy of a very concerned, loving, and creative family."" —Library Media Connection  Award 2014 Texas 2x2 Reading Award List Notable Children's Books from ALSC 2014",,,,,,,48,,,,,English,,,,9781419707766,0,0,,Unread,,,,,,,0,,,,2018/12/11 14:49:32.178966999,,,,,,vO3angEACAAJ,,0,,
Hug It Out!,,,,,Louis Thomas,"Thomas, Louis",,,,,Macmillan,2017/01/03,2017,,Juvenile Fiction,"A fresh, funny take on sibling rivalry and conflict resolution, as two sparring siblings are forced to ""hug it out.""Mom has had enough of Woody and Annie's incessant fighting. When her pleas for sharing and apologizing are ignored, she demands they ""hug it out."" At first, the warring siblings are confused. Hugging? But after a long afternoon of forced embraces, the brother and sister decide to call a truce to avoid yet another icky hug. However it doesn't take long for them to miss that newfound closeness. And soon they're looking for something to fight about so they can hug it out once more! Adults will delight in a new solution to conflict, while kids will enjoy yelling ""HUG IT OUT!"" at each familiar situation. With subversive humor and smart, eye-catching illustrations, Louis Thomas's debut is a cheeky tribute to sibling rivalry and (cuddly) compromise.",,,,,,,40,,,,,English,,,,9780374303143,0,0,,Unread,,,,,,,0,,,,2018/12/18 14:36:52.99271059,,,,,,3sZlDQAAQBAJ,,0,,
"It's a Big World, Little Pig!",,,,,Kristi Yamaguchi,"Yamaguchi, Kristi",,,,,"Sourcebooks, Incorporated",,2012,,Juvenile Fiction,"Poppy, the adorable, persistent, dreaming-big pig, has a new adventure in store for her: the World Games ice-skating championship in Paris! Poppy is nervous about meeting so many new people in a new place. But, ever courageous and supported by her family (Emma, too!), Poppy embarks upon this exciting adventure head-on. She meets a snowboarding Panda, a Maltese who skies, and two fellow skaters, a Crane and a Kangaroo. Poppy begins to realize that although these animals look different, act different, and are from different places, they are all the same at heart. They all smile in the same language!",,,,,,,32,,,,,English,,,,9781402266447,0,0,,Unread,,,,,,,0,,,,2018/12/18 14:36:52.154217004,,,,,,hmRYXwAACAAJ,,0,,
It's Sharing Day!,,,,,Kirsten Larsen,"Larsen, Kirsten",,,,,Simon and Schuster,2007/01/23,2007,,Juvenile Fiction,"It's Sharing Day! Join Dora and Boots on their way to Abuela's house for a special Sharing Day lunch. First they have to pick up ingredients for their special dessert. Along the way, they learn how important and rewarding it is to share.",,,,,,,24,,,,,English,,,,9781416915751,0,0,,Unread,,,,,,,0,,,,2018/12/18 14:36:52.45532941,,,,,,OyDuhcrZugQC,,0,,
Ladybug Girl and the Bug Squad,,,,,David Soman,"Soman, David",,,,,Penguin,,2011,,Juvenile Fiction,"The Bug Squad is back in a story about playing together, problem solving, and saying you're sorry in this hardcover picture book from the New York Times bestselling Ladybug Girl series.   This book was a Jumpstart Read for the Record Book.   The Bug Squad ? Bumblebee Boy, Dragonfly Girl, and Butterfly Girl ? are coming to Lulu's house for a play date and she know exactly what they are going to do all day. They use their big imaginations to create their own fun games right in Lulu's backyard. But when some things don't go just the way Lulu planned, Dragonfly Girl's feelings get hurt. This is a job for Ladybug Girl! When Lulu is Ladybug Girl, she knows that even if it isn't easy, it is important to apologize.  For fans of Fancy Nancy and Betty Bunny, the Ladybug Girl series honors individuality, friendship, and a love of nature!",,,,,,,40,,,,,English,,,,9780803734197,0,0,,Unread,,,,,,,0,,,,2018/12/18 14:36:52.28049945,,,,,,UX8QDAAAQBAJ,,0,,
Lemonade in Winter,,A Book About Two Kids Counting Money,,,Emily Jenkins,"Jenkins, Emily",,,,,Schwartz & Wade Books,,2012,,Juvenile Fiction,"In a starred review, Publishers Weekly declared this delightful picture book ""a beautifully restrained tribute to trust and tenderness shared by siblings; an entrepreneurship how-to that celebrates the thrill of the marketplace without shying away from its cold realities; and a parable about persistence.""A lemonade stand in winter? Yes, that's exactly what Pauline and John-John intend to have, selling lemonade and limeade--and also lemon-limeade. With a catchy refrain (Lemon lemon LIME, Lemon LIMEADE! Lemon lemon LIME, Lemon LEMONADE!), plus simple math concepts throughout, here is a read-aloud that's great for storytime and classroom use, and is sure to be a hit among the legions of Jenkins and Karas fans.",,,,,,,40,,,,,English,,,,9780375858833,0,0,,Unread,,,,,,,0,,,,2018/12/11 14:49:32.187826037,,,,,,wRJPG5k1ctAC,,0,,
Little Babymouse and the Christmas Cupcakes,,,,,Jennifer L. Holm,"Holm, Jennifer L.",,,,,Random House,,2016,,Juvenile Fiction,"Graphic-novel darling Babymouse makes her picture-book debut in a Christmas story . . . all about cupcakes! (Typical.)  Thank goodness Babymouse ate all of the Christmas cookies her mom made for Santa. Now she can make him something he really wants--CUPCAKES! But wait . . . what's that rumbling in the other room? OH NO! A DRAGON!!!!! Can Sir Babymouse defeat her fiery foe and save Christmas?! Or at least save a cupcake or two? Maybe not. . . .  Jennifer and Matthew Holm bring us Babymouse's very first full-color adventure! With signature Babymouse humor, comic book-style panels, and oodles of pink-frosted cupcakes, new readers and devoted fans alike will find plenty to love.",,,,,,,40,,,,,English,,,,9781101937433,0,0,,Unread,,,,,,,0,,,,2018/12/18 14:36:52.181198000,,,,,,nuj4DAAAQBAJ,,0,,
Little Yoga,,A Toddler's First Book of Yoga,,,Rebecca Whitford,"Whitford, Rebecca",,,,,Macmillan,2005/09/01,2005,,Juvenile Nonfiction,"Yoga Baby spreads his arms out like a butterfly . . .Yoga Baby wobbles like a little bird . . . Yoga Baby says ""time for rest—ahh, shh, shh""A perfect introduction to yoga for toddlers Here is a playful introduction to nine simple yoga exercises for young children. Toddlers will enjoy moving along with Yoga Baby as they follow the basic poses. Unlike most books on the subject, Yoga Baby is aimed directly at preschoolers. This interactive picture book also includes helpful information for parents and educators. Fun, accessible, and colorful—it's a great way for little ones to discover yoga.",,,,,,,28,,,,,English,,,,9780805078794,0,0,,Unread,,,,,,,0,,,,2018/12/18 14:36:52.80366015,,,,,,Bi-1g9OmnuwC,,0,,
Love is a Good Thing to Feel,,,,,Barbara M. Joosse,"Joosse, Barbara M.",,,,,Philomel Books,,2008,,Juvenile Fiction,"Did you know that there are many ways to say 'I love you'? Harriet does. You can say it with a hug, or a drawing, or out loud. And she knows that you can still love someone even when they go to a party you weren't invited to, or when a parent puts you in time-out for tap-dancing on the table (and you are terribly angry). Sassy Harriet will walk right into your heart in this adorable and lovely companion to the popular Please Is a Good Word to Say. With a die-cut heart, indispensable advice, and a character we already embrace - well, what's not to love?",,,,,,,32,,,,,English,,,,9780399251689,0,0,,Unread,,,,,,,0,,,,2018/12/18 14:36:52.175253987,,,,,,GSv5PQAACAAJ,,0,,
Max's Christmas,,,,,Rosemary Wells,"Wells, Rosemary",,,,,Puffin Books,,2013,,,,,,,,,,,,,,,,,,,9780606321396,0,0,,Unread,,,,,,,0,,,,2018/12/18 14:36:52.125763058,,,,,,,,0,http://images.amazon.com/images/P/060632139X.01Z.jpg,
Mimi and Shu in I'll Race You!,,,,,Christian Trimmer,"Trimmer, Christian",,,,,Simon and Schuster,2015/12/15,2015,,Juvenile Fiction,"Mimi and Shu are in a race to make history (and dessert) in this inventive and fun reimagining of the origins of the Chinese zodiac.Shu the mouse has his eyes set on making history. His best friend Mimi the cat, on the other hand, has her eyes set on cupcakes. When Emperor Jade invites Mimi, Shu, and a bunch of their animal friends to his big race for a spot in the Chinese zodiac—and a big plate of cupcakes—Shu and Mimi are determined to win. But with their eyes set on different prizes, can Mimi and Shu work together to win Emperor Jade’s great race? Or will the lure of sweet (and sugary) victory come between them for good?",,,,,,,40,,,,,English,,,,9781481423304,0,0,,Unread,,,,,,,0,,,,2018/12/18 14:36:52.86413025,,,,,,XsgoCwAAQBAJ,,0,,
Olivia Helps with Christmas,,,,,Ian Falconer,"Falconer, Ian",,,,,Simon and Schuster,2007/10/02,2007,,Juvenile Fiction,"Everyone's favorite Caldecott honor-winning porcine and #1 Kris Cringle enthusiast is helping to make the season brighter than ever. Christmas is coming, and Olivia is incredibly busy. She has to wait for Santa, make sure dad sets up the tree, wait for Santa, watch mom make the Christmas dinner, wait for Santa, oversee the care with which the stockings are hung and, of course, OPEN HER PRESENTS! Do you see how hard it is to be so helpful during the holidays! A lovingly-told and lavishly-illustrated Olivia Helps With Christmas is the perfect stuffing for any stocking, and the newest star atop the Olivia series.",,,,,,,58,,,,,English,,,,9781416907862,0,0,,Unread,,,,,,,0,,,,2018/12/18 14:36:52.74630975,,,,,,YVgjAQAAQBAJ,,0,,
Penguin Problems,,,,,Jory John,"John, Jory",,,,,Random House Children's Books,,2016,,Juvenile Fiction,"Have you ever thought: I have so many problems and nobody even cares? Well, penguins have problems too! Discover them in this hilarious collaboration from Jory John (All my friends are dead. and Quit Calling Me a Monster!) and Lane Smith (The Stinky Cheese Man and Other Fairly Stupid Tales)!  This penguin has come to tell you that life in Antarctica is no paradise. For starters, it is FREEZING. Also, penguins have a ton of natural predators. Plus, can you imagine trying to find your mom in a big ol' crowd of identical penguins? No, thank you.  Yes, it seems there is no escaping the drudgery of your daily grind, whatever it might be. Or perhaps we've just learned that grumps are everywhere. . . .   This book is sure to tickle kids' funny bones and will elicit appreciative sighs from the adults reading it aloud.  ""We are all Mortimer [the main character in Penguin Problems]."" --The New York Times  ""Bursting with humor."" --Kirkus Reviews  ""The snark level is cranked up high."" --The Horn Book, Starred  ""Will be right at home with fans of Jon Klassen's This Is Not My Hat."" --Booklist  ""Classic comedy."" --Publishers Weekly  ""Rib-tickling."" --School Library Journal",,,,,,,32,,,,,English,,,,9780553513370,0,0,,Unread,,,,,,,0,,,,2018/12/11 14:49:32.136003971,,,,,,DFzqDAAAQBAJ,,0,,
Silverlicious,,,,,Victoria Kann,"Kann, Victoria",,,,,Harper Collins,2011/02/01,2011,,Juvenile Fiction,"When Pinkalicious loses a tooth, it's not just any tooth—it's her sweet tooth! Suddenly candy no longer tastes sweet! With her pinkatastic pen, Pinkalicious writes a note to the Tooth Fairy and tucks it under her pillow . . . only to hear from Cupid, the Easter Bunny, and a Christmas elf instead. It is not until the Tooth Fairy finally responds—and works some magic—that Pinkalicious discovers where sweetness really comes from.   Fairy-tale characters and sparkling scenes make Silverlicious a sweet treat for all.",,,,,,,40,,,,,English,,,,9780061781230,0,0,,Unread,,,,,,,0,,,,2018/12/18 14:36:52.54666996,,,,,,pJxk1PBtXSoC,,0,,
Sofia Makes A Friend,,,,,"Cathy Hapka, Character Building Studio (Firm), Disney Storybook Artists","Hapka, Cathy",,,,,Disney Press,,2013,,Juvenile Fiction,,,,,,,,32,,,,,,,,,9781423164081,0,0,,Unread,,,,,,,0,,,,2018/12/18 14:36:52.145267963,,,,,,,,0,http://images.amazon.com/images/P/1423164083.01Z.jpg,
Space Dog,,,,,Mini Grey,"Grey, Mini",,,,,Random House Children's Books,,2015,,Juvenile Fiction,"Meet Space Dog, Astrocat, and Mousetronaut in this hilarious adventure about teamwork and unexpected friendship from the award-winning creator of Traction Man.  Space Dog is zooming through Cake Space on the SS Kennel when he receives the first of many distress calls from the vast Spooniverse. Can he rescue the Cereal People, plug up the Ketchup Volcanoes, and defeat the Cheese Ants? All on his own? He might need some help. But Space Dogs, Astrocats, and Mousetronauts have always been sworn enemies! Can they put aside their differences to save the Spooniverse?  This hilarious offering from the award-winning Mini Grey is a non-stop adventure, a celebration of imaginative play, and a triumphant story in which sworn enemies become . . . sworn friends!",,,,,,,40,,,,,English,,,,9780553510584,0,0,,Unread,,,,,,,0,,,,2018/12/18 14:36:52.138600945,,,,,,HHjroQEACAAJ,,0,,
Sugar Would Not Eat It,,,,,Emily Jenkins,"Jenkins, Emily",,,,,Schwartz & Wade Books,,2009,,Juvenile Fiction,"Like children everywhere, Sugar the cat refuses to eat food she doesn’t like! All children have heard their parents try to threaten, cajole, and guilt them into eating their vegetables. And it’s no different for Leo’s new cat, Sugar. She’s hungry, but when Leo generously gives her his last piece of birthday cake, Sugar will not eat it. Leo finally gives up. He fixes himself a chicken sandwich and some milk. Suddenly, guess who is up on the counter, nibbling at Leo’s sandwich?  Features a great cast of neighborhood characters—each with their own tidbit of advice—that is also the perfect tool for parents to use with children to talk about food.",,,,,,,40,,,,,English,,,,9780375836039,0,0,,Unread,,,,,,,0,,,,2018/12/18 14:36:52.61897993,,,,,,JhE71JyNrKgC,,0,,
Tallulah's Tutu,,,,,Marilyn Singer,"Singer, Marilyn",,,,,Houghton Mifflin Harcourt,,2011,,Juvenile Fiction,"Tallulah just knew she could be a great ballerina, if only she had a tutu. So she starts ballet class. When she does not receive a tutu, she quits. But everywhere she goes, things keep reminding her of ballet. Her neighbor's basset hound always stands in second position. The kitchen clock performs perfect ronds de jambe. And Tallulah can't seem to stop doing ballet, either. A park bench makes a perfect barre, and what better way to pet the dog than with a graceful pli'? This well-told, funny story with a smart new character will satisfy girls' cravings for pretty and pink, but also shows that ballet is about more than just the tutu.",,,,,,,40,,,,,English,,,,9780547173535,0,0,,Unread,,,,,,,0,,,,2018/12/18 14:36:52.105532050,,,,,,gN4D6JalwygC,,0,,
The Dream Jar,,,,,Lindan Johnson,"Johnson, Lindan",,,,,Houghton Mifflin Company,,2005,,Juvenile Fiction,"One little girl, with the help of her sister, discovers The Secret for turning bad dreams into good ones. Original, quirky, and rich illustrations complement this sparkling story that deals with the very real problem of children's nightmares.  Discover the Dream Jar and the power of your imagination--and turn your terribly horrible dreams into dreamy ones.",,,,,,,32,,,,,English,,,,9780618176984,0,0,,Unread,,,,,,,0,,,,2018/12/18 14:36:52.168586015,,,,,,c3QtmQEACAAJ,,0,,
The gumdrop tree,,,,,Elizabeth Spurr,"Spurr, Elizabeth",,,,,Hyperion Books for Children,,1994,,Fiction,,,,,,,,,,,,,,,,,9780786820047,0,0,,Unread,,,,,,,0,,,,2018/12/18 14:36:52.111606001,,,,,,,,0,https://covers.openlibrary.org/b/id/7271333-L.jpg,
The Itsy Bitsy Spider,,,,,Iza Trapani,"Trapani, Iza",,,,,Charlesbridge Publishing,,1993,,Juvenile Fiction,"The spirited itsy bitsy spider has captured the hearts of generations of children in the much-loved nursery rhyme. Now she's back--on a new magical journey!  This all-new adventure for the itsy bitsy spider has exciting encounters with a fan, a mouse, a rocking chair, a cat, and a big maple tree. Finally, the itsy bitsy spider finds a lovely spot to spin a new silky web. Iza Trapani's vibrant watercolor illustrations paired with a playful rhythm makes this new take on an old favorite feel like an instant classic. A perfect read-aloud; children will enjoy time and again the delightful antics of the energetic itsy bitsy spider.",,,,,,,32,,,,,English,,,,9781879085770,0,0,,Unread,,,,,,,0,,,,2018/12/18 14:36:52.92625975,,,,,,B0jGhMo6XuAC,,0,,
They All Saw a Cat,,,,,Brendan Wenzel,"Wenzel, Brendan",,,,,Chronicle Books,2016/08/30,2016,,Juvenile Fiction,"They All Saw A Cat by Brendan Wenzel - New York Times bestseller and 2017 Caldecott Medal and Honor BookThe cat walked through the world, with its whiskers, ears, and paws . . . In this glorious celebration of observation, curiosity, and imagination, Brendan Wenzel shows us the many lives of one cat, and how perspective shapes what we see. When you see a cat, what do you see?If you and your child liked Ricky the Rock That Couldn't Roll, The Wonderful Things You Will Be, The Girl Who Drank the Moon, Finding Winnie, or Radiant Child - you'll love They All Saw A Cat""An ingenious idea, gorgeously realized."" -Shelf Awareness, starred review""Both simple and ingenious in concept, Wenzel's book feels like a game changer."" -The Huffington Post",,,,,,,44,,,,,English,,,,9781452150130,0,0,,Unread,,,,,,,0,,,,2018/12/18 14:36:52.132897973,,,,,,F4wRjwEACAAJ,,0,,
Thumbelina,,,,,Brad Sneed,"Sneed, Brad",,,,,Dial Books for Young Readers,,2004,,Fairy tales,,,,,,,,,,,,,,,,,9780803728127,0,0,,Unread,,,,,,,0,,,,2018/12/18 14:36:52.117719054,,,,,,,,0,https://covers.openlibrary.org/b/id/575495-L.jpg,
Toot & Puddle: I'll Be Home for Christmas,,Picture Book #5,,,Holly Hobbie,"Hobbie, Holly",,,,,"Little, Brown Books for Young Readers",2001/10/01,2001,,Juvenile Fiction,"When Puddle wakes up one morning, Toot is missing! Although Puddle usually prefers to stay home in Woodcock Pocket, his concern for his best friend prompts him to set off. Puddle takes a train and then a plane, and eventually finds himself in a far-away place. And who do you think he finds? Holly Hobbie's story of a friendship that extends to the top of the world will be welcomed by the many fans of Toot and Puddle.",,,,,,,32,,,,,English,,,,9780316366236,0,0,,Unread,,,,,,,0,,,,2018/12/11 14:49:32.169746041,,,,,,qK1uiiI2AuEC,,0,,
Two of Everything,,,,,Lily Toy Hong,"Hong, Lily Toy",,,,,Open Road Media,2014/05/06,2014,,Juvenile Fiction,"When old Mr. Haktak digs up a curious brass pot in his garden, he has no idea what use it can be. On his way home, Mr. Haktak decides to carry his coin purse in the mysterious pot. But when Mrs. Haktak’s hairpin accidentally slips into the pot and she reaches in to retrieve it, the magic of the pot is revealed. Not only are there two hairpins inside, but there are also two purses!",,,,,,,32,,,,,English,,,,9781497635937,0,0,,Unread,,,,,,,0,,,,2018/12/11 14:51:18.436159968,,,,,,jntgAwAAQBAJ,,0,,
