Title,Original Title,Subtitle,Series,Volume,Author,"Author (Last, First)",Illustrator,Narrator,Translator,Editor,Publisher,Date Published,Year Published,Edition,Genre,Summary,Guided Reading Level,Lexile Measure,Grade Level Equivalent,Developmental Reading Assessment,Interest Level,Word Count,Number of Pages,Format,Dimensions,Weight,List Price,Language,DDC,LCC,OCLC,ISBN,Favorites,Rating,Physical Location,Status,Date Started,Date Finished,Loaned To,Date Loaned,Borrowed From,Date Borrowed,Returned from Borrow,Quantity,Condition,Recommended By,Date Added,Tags,Purchase Date,Purchase Place,Purchase Price,Notes,Google VolumeID,Category,Wish List,Uploaded Image URL,Activities
"LEGO Adventure Book, Vol. 1",,"Cars, Castles, Dinosaurs & More!",,,Megan H. Rothrock,"Rothrock, Megan H.",,,,,No Starch Press,,2012,,Crafts & Hobbies,"Unleash your imagination as you journey through the wide-ranging world of LEGO building with The LEGO Adventure Book. This inspiring tour is filled with bright visuals, step-by-step breakdowns of 25 models, and nearly 200 example models from the world's best builders. Learn to build robots, trains, medieval villages, spaceships, airplanes, and much more. Whether you're brand-new to LEGO or have been building for years, this book is sure to spark your imagination and motivate you to keep creating!",,,,,,,200,,,,,English,,,,9781593274429,0,0,,Unread,,,,,,,0,,,,2018/04/10 11:58:36.806254982,,,,,,qUEQAQAAQBAJ,,0,,
The Pout-Pout Fish Goes to School,,,,,Deborah Diesen,"Diesen, Deborah",,,,,Macmillan,2014/06/24,2014,,Juvenile Fiction,"Turn little pouts into big smiles! Mr. Fish is nervously awaiting his first day of school, and he frets about not knowing how to write his name, how to draw shapes, and how to do math—until he's reassured that school is the perfect place to learn how to master all of these new skills, in Pout-Pout Fish Goes to School from Deborah Diesen and Dan Hanna.",,,,,,,32,,,,,English,,,,9780374360955,0,0,,Unread,,,,,,,0,,,,2018/04/10 11:58:36.796605944,,,,,,pKHzAgAAQBAJ,,0,,
Llama Llama Gram and Grandpa,,,,,Anna Dewdney,"Dewdney, Anna",,,,,Penguin Young Readers Group,,2015,,Juvenile Fiction,"It's an exciting day for Llama Llama; he's going to visit Gram and Grandpa Llama and spend the night! His first night away from home....and from Mama. But he makes sure to pack everything he needs. And there are so many fun things to do with Gram and Grandpa. It's not until he gets ready for bed that he realizes that he's forgotten something important. Fuzzy Llama! Fortunately, Grandpa Llama has a wonderful solution and soon Llama Llama is having sweet dreams.",,,,,,,40,,,,,English,,,,9780670013968,0,0,,Unread,,,,,,,0,,,,2018/04/10 11:58:36.785943984,,,,,,IunaCwAAQBAJ,,0,,
Clink,,,,,Kelly S. DiPucchio,"DiPucchio, Kelly S.",,,,,Balzer & Bray,,2011,,Fiction,,,,,,,,,,,,,,,,,9780061929281,0,0,,Unread,,,,,,,0,,,,2018/04/10 11:58:36.779590964,,,,,,,,0,https://covers.openlibrary.org/b/id/7276802-L.jpg,
The Nutcracker Doll,,,,,Mary Newell DePalma,"DePalma, Mary Newell",,,,,Arthur A. Levine Books,,2007,,Juvenile Fiction,"Finally, the perfect gift for any girl who loves ballet.  Tutus, stage lights, and tights-wearing mice - a girl's giddy first experience dancing in THE NUTCRACKER is celebrated for all to share. For a young dancer, everything about ""The Nutcracker"" is thrilling, from auditions to opening night. Readers experience it all with Kepley as she dances before judges, goes to rehearsals, and stifles giggles as she gets carried offstage by a man dressed as a giant mouse! DePalma expertly takes readers backstage and into the heart of a small dancer as THE NUTCRACKER DOLL captures the magic of theater and the thrill of being part of a great ballet.",,,,,,,32,,,,,English,,,,9780439802420,0,0,,Unread,,,,,,,0,,,,2018/04/10 11:58:36.767761945,,,,,,NPfvAAAAMAAJ,,0,,
Last Stop on Market Street,,,,,Matt de la Pena,"Pena, Matt de la",,,,,Penguin,,2015,,Juvenile Fiction,"#1 NEW YORK TIMES BESTSELLER Winner of the 2016 Newbery MedalA 2016 Caldecott Honor BookA 2016 Coretta Scott King Illustrator Honor BookA New York Times Book Review Notable Children's Book of 2015A Wall Street Journal Best Children's Book of 2015 Every Sunday after church, CJ and his grandma ride the bus across town. But today, CJ wonders why they don't own a car like his friend Colby. Why doesn't he have an iPod like the boys on the bus? How come they always have to get off in the dirty part of town? Each question is met with an encouraging answer from grandma, who helps him see the beauty--and fun--in their routine and the world around them. This energetic ride through a bustling city highlights the wonderful perspective only grandparent and grandchild can share, and comes to life through Matt de la Pena's vibrant text and Christian Robinson's radiant illustrations.",,,,,,,32,,,,,English,,,,9780399257742,0,0,,Unread,,,,,,,0,,,,2018/04/10 11:58:36.758265972,,,,,,NS3eDAAAQBAJ,,0,,
Little Yoga,,A Toddler's First Book of Yoga,,,Rebecca Whitford,"Whitford, Rebecca",,,,,Macmillan,2005/09/01,2005,,Juvenile Nonfiction,"Yoga Baby spreads his arms out like a butterfly . . .Yoga Baby wobbles like a little bird . . . Yoga Baby says ""time for rest—ahh, shh, shh""A perfect introduction to yoga for toddlers Here is a playful introduction to nine simple yoga exercises for young children. Toddlers will enjoy moving along with Yoga Baby as they follow the basic poses. Unlike most books on the subject, Yoga Baby is aimed directly at preschoolers. This interactive picture book also includes helpful information for parents and educators. Fun, accessible, and colorful—it's a great way for little ones to discover yoga.",,,,,,,28,,,,,English,,,,9780805078794,0,0,,Unread,,,,,,,0,,,,2018/04/10 11:58:36.748435020,,,,,,Bi-1g9OmnuwC,,0,,
Ginger,,,,,Charlotte Voake,"Voake, Charlotte",,,,,Candlewick Press,,1997,,Juvenile Fiction,"Ginger the cat lives a comfortable, well-tended life. But when a pesky kitten moves in, Ginger's days of ease of over. Now it seems he must share his bed and his meals with the intruder forever. What is a pampered cat to do? Full-color illustrations.",,,,,,,32,,,,,English,,,,9780763601089,0,0,,Unread,,,,,,,0,,,,2018/04/10 11:58:36.736399054,,,,,,KFThAAAAMAAJ,,0,,
Little Excavator,,,,,Anna Dewdney,"Dewdney, Anna",,,,,Penguin,,2017,,Juvenile Fiction,"From New York Times bestselling author-illustrator of the Llama Llama books comes a new character ready to dig his way into your heart!  Here come the BIG RIGS rolling down the street.  Thumpa-thumpa bumpa-bumpa BEEP! BEEP! BEEP! There's Loader and Dump Truck, Backhoe and Crane. They're ready to transform a vacant lot into a neighborhood park. And who wants to help most of all?  Little Excavator! But are there any jobs for someone so small?  Anna Dewdney's signature rhyming text and inviting illustrations make this a perfect read aloud for for fans of things that go!",,,,,,,44,,,,,English,,,,9781101999202,0,0,,Unread,,,,,,,0,,,,2018/04/10 11:58:36.726202011,,,,,,j1DNDgAAQBAJ,,0,,
Mini racer,,,,,Kristy Dempsey,"Dempsey, Kristy",,,,,Bloomsbury Children's Books,,2011,,Stories in rhyme,"Ready, steady, green light, go! Mini Racer won't go slow.  Twelve little vehicles are lined up and ready to race. With speed bumps to jump and corners to round, who will take the lead? The winner just might surprise you. This rhyming text is filled with onomatopoeia sure to tickle the funny bones of little readers. Beep, beep! Watch out as they race to turn the pages and follow each animal's themed story. And the chase doesn't end with the last screech; little ones will beg to read it over again to discover all of the details in the art. Mini Racer is a must-have for story time!",,,,,,,,,,,,,,,,9781599901701,0,0,,Unread,,,,,,,0,,,,2018/04/10 11:58:36.663226962,,,,,,,,0,https://covers.openlibrary.org/b/id/6686600-L.jpg,
My Friend the Moon,,,,,André Dahan,"Dahan, André",,,,,Brolly Books,,2008,,Moon,"A whimsical and delightful tale about a young boy who befriends the moon. Unfortunately, the moon has a mishap and falls from the sky. The boy takes him home, and together they forge a special friendship . . . This is a charming story that will capture the heart of anyone who has ever dreamt of meeting the moon.",,,,,,,160,,,,,English,,,,9781921346316,0,0,,Unread,,,,,,,0,,,,2018/04/03 07:32:09.971019983,,,,,,4k7xNAAACAAJ,,0,,
Busy beavers,,,,,Lydia Dabcovich,"Dabcovich, Lydia",,,,,Scholastic,,1989,,Beavers,"Simple text follows the activities of a beaver family as they swim, play, and build a sturdy dam.",,,,,,,32,,,,,English,,,,9780590428071,0,0,,Unread,,,,,,,0,,,,2018/04/03 07:31:51.754240036,,,,,,K7xfRO7iUe4C,,0,,
The Curious Kid's Science Book,,100+ Creative Hands-On Activities for Ages 4-8,,,Asia Citro,"Citro, Asia",,,,,Innovation Press,,2015,,FAMILY & RELATIONSHIPS,"What happens if you water plants with juice? Where can you find bacteria in your house? Is slug slime as strong as a glue stick? How would your child find the answers to these questions?  In The Curious Kid's Science Book, your child will learn to design his or her own science investigations to determine the answers! Children will learn to ask their own scientific questions, discover value in failed experiments, and -- most importantly -- have a blast with science. The 100+ hands-on activities in the book use household items to playfully teach important science, technology, engineering, and math skills. Each creative activity includes age-appropriate explanations and (when possible) real life applications of the concepts covered. Adding science to your at-home schedule will make a positive impact on your child's learning. Just one experiment a week will help build children's confidence and excitement about the sciences, boost success in the classroom, and give them the tools to design and execute their own science fair projects.",,,,,,,224,,,,,English,,,,9781943147007,0,0,,Unread,,,,,,,0,,,,2018/04/03 07:31:03.577065944,,,,,,1oxQrgEACAAJ,,0,,
Jamberry,,,,,Bruce Degen,"Degen, Bruce",,,,,HarperCollins,1983/03/23,1983,,Juvenile Fiction,"HatberryShoeberryIn my canoeberryUnder the bridgeAnd over the damLooking for berries Berries for jamThey're off...a boy and an endearing, rhyme-spouting bear, who squires him through a fantastic world of berries. And their adventure comes to a razzamatazz finale under a starberry sky.Children will want to feast again and again on Bruce Degen's exuberant, colorful pictures and his rollicking, berryful rhymes.HatberryShoeberryIn my canoeberyUnder the bridgeAnd over the damLooking for berriesBerries for jamThey're off...a boy and an endearing, rhyme-spouting bear, who squires him through a fatastic world of berries. And their adventure comes to a razzamatazz finale under a starberry sky. Children will want to feast again and again on Bruce Degen's exuberant, colorful pictures and his rollicking berryful rhymes.",,,,,,,32,,,,,English,,,,9780060214166,0,0,,Unread,,,,,,,0,,,,2018/04/03 07:31:03.555662989,,,,,,Z6PJ8Lj9YuYC,,0,,
A Kitten's Year,,,,,Nancy Raines Day,"Day, Nancy Raines",,,,,HarperCollins,1999/12/22,1999,,Juvenile Fiction,"Peeking, pawing, and pouncing, a curious kitten spends its first year exploring the sights, sounds, and smells of the world around it. The simple text and exquisite, detailed illustrations in this beautiful book of months capture the cozy and distinctly feline moments of a kitten as it grows, season, by season, into a cat.",,,,,,,32,,,,,English,,,,9780060272302,0,0,,Unread,,,,,,,0,,,,2018/04/03 07:31:03.535071015,,,,,,P9o0pr-bPiIC,,0,,
Jamela's dress,,,,,Niki Daly,"Daly, Niki",,,,,"Farrar, Straus Giroux",,1999,,Fiction,,,,,,,,,,,,,,,,,9780374336677,0,0,,Unread,,,,,,,0,,,,2018/04/03 07:31:03.519708037,,,,,,,,0,https://covers.openlibrary.org/b/id/1188613-L.jpg,
The Enormous Potato,,,,,Aubrey Davis,"Davis, Aubrey",,,,,Kids Can Press,,1998,,Juvenile Fiction,"Folk tales give us hope. They show us that we can succeed in spite of apparent problems. And they entertain. Perhaps this accounts for their universal appeal and their amazing ability to survive. ""The Enormous Potato"" is one such story that has been around for generations. Retold by professional storyteller Aubrey Davis, it shows what can be accomplished when everyone lends a hand to solve a problem. The Enormous Potato begins with a farmer who plants an eye -- a potato eye. It grows and grows into an enormous potato. Harvest time comes, but the potato is so big that the farmer can't pull it out. So he calls for help, first to his wife, then to their daughter, then to the dog and so on. Energetic illustrations capture the growing determination of the family to free the potato from the soil and the celebratory feast that follows their success.",,,,,,,30,,,,,English,,,,9781550743869,0,0,,Unread,,,,,,,0,,,,2018/04/03 07:31:03.499698996,,,,,,qHgSAAAACAAJ,,0,,
Lots of Ladybugs!,,Counting by Fives,,,Michael Dahl,"Dahl, Michael",,,,,Capstone,,2005,,Juvenile Nonfiction,Introduces counting by fives by counting the number of spots on the shell of a ladybug. Readers are invited to find hidden numbers on an illustrated activity page.,,,,,,,24,,,,,English,,,,9781404809444,0,0,,Unread,,,,,,,0,,,,2018/04/03 07:31:03.479900002,,,,,,3z6cBAAAQBAJ,,0,,
The Storm Whale in Winter,,,,,Benji Davies,"Davies, Benji",,,,,Henry Holt and Company (BYR),2017/01/24,2017,,Juvenile Fiction,"In this sequel to The Storm Whale, the boy, Noi, is caught in a storm at sea and his whale friend comes to his rescue.When Noi's dad sails out on one last fishing trip before winter, Noi waits for him at home. But as the storm worsens and his dad does not return, Noi decides to go looking for his dad. But the storm is powerful and dangerous, and soon Noi, too, is stuck in the icy sea. When it seems that all hope is lost, a friend comes to help Noi and his father. Poignant and evocative, this is a beautiful celebration of friendship and family, and the special bond between a father and son.",,,,,,,32,,,,,English,,,,9781250111869,0,0,,Unread,,,,,,,0,,,,2018/04/03 07:31:03.458650946,,,,,,3w0HkAEACAAJ,,0,,
Pete the Cat and His Magic Sunglasses,,,,,"James Dean, Kimberly Dean","Dean, James",,,,,HarperCollins,2013/10/01,2013,,Juvenile Fiction,"From the bestselling Pete the Cat series, Pete's magic sunglasses help him turn his mood from grumpy to awesome!In this hardcover picture book, Pete the Cat wakes up feeling grumpy—nothing seems to be going his way. But with the help of some magic sunglasses, Pete learns that a good mood has been inside him all along.Fans of Pete the Cat will love watching him take his positive outlook and transform a grumpy day into an awesome day!The fun never stops—download the free groovin’ song. Time for magic fun in the sun!",,,,,,,40,,,,,English,,,,9780062275561,0,0,,Unread,,,,,,,0,,,,2018/04/03 07:31:03.438025951,,,,,,aYDdlwEACAAJ,,0,,
"Ants in Your Pants, Worms in Your Plants!",,(Gilbert Goes Green),,,Diane deGroat,"deGroat, Diane",,,,,HarperCollins,2011/02/22,2011,,Juvenile Fiction,"Gilbert has trouble coming up with ideas. First he couldn't think of a springtime poem, and now he needs an idea for an Earth Day project! Everyone else in Mrs. Byrd's class is busy working on posters about recycling and saving water and electricity, but Gilbert wants to do something original. A distressing class picnic inspires him, and he comes up with an Earth Day project that even Mrs. Byrd thinks is the best idea yet.   With vivid, lively illustrations and a timely story about how kids really can help the world around them, Diane deGroat shows readers of all ages that sometimes the simplest solutions are right in our own backyards!",,,,,,,32,,,,,English,,,,9780061765117,0,0,,Unread,,,,,,,0,,,,2018/04/03 07:31:03.417924046,,,,,,Tq0aSwAACAAJ,,0,,
Brick City,,Global Icons to Make from Lego,,,Warren Elsmore,"Elsmore, Warren",,,,,Barron's Educational Series,,2013,,Crafts & Hobbies,"Brick City is a model builder's festival in book form. What lends special distinction to the models is the way they're constructed. Each is made entirely of LEGO bricks! Known for decades as a favorite children's toy, LEGO bricks have entered the adult model builder's repertoire in recent years. Author and model maker Warren Elsmore presents instructions for neophyte LEGO modelers plus plans for constructing specific buildings and landmarks, along with vivid photos of completed LEGO models. The models represent landmarks from all over the world, and include--   St. Basil's Cathedral New York's New World Trade Center The Arc de Triomphe Rome's Colosseum A London taxicab Hong Kong ferries Buckingham Palace. . . and many others  Featuring amazing photos of LEGO models, and scale drawings of structural details to guide model builders, Brick City presents a modeler's panorama of contemporary urban landscapes. More than 400 illustrations in color and black and white.  BONUS POSTERS: Enclosed with the book are two dramatic posters featuring LEGO® model photos of architectural world landmarks. The posters, which are suitable for framing, unfold to 17 1/2"" x 24 3/4""",,,,,,,256,,,,,English,,,,9781438002491,0,0,,Unread,,,,,,,0,,,,2018/04/03 07:31:03.400279045,,,,,,LwGLMAEACAAJ,,0,,
Yoga Games for Children,,"Fun and Fitness with Postures, Movements and Breath",,,"Danielle Bersma, Marjoke Visscher","Bersma, Danielle",,,,,Hunter House,,2003,,FAMILY & RELATIONSHIPS,"This introduction to yoga for children contains variations on traditional yoga postures that help children develop physical strength, flexibility, emotional calm, and self-expression. The games involve relaxation, trust, and cooperation. Included are over 50 illustrations and 16 completely structured lessons based on themes like the seasons, rain, snow, and animals.",,,,,,,146,,,,,English,,,,9780897933896,0,0,,Unread,,,,,,,0,,,,2018/04/03 07:31:03.382202029,,,,,,JPMnoDZ75XMC,,0,,
The Rooster Who Would Not Be Quiet!,,,,,Carmen Agra Deedy,"Deedy, Carmen Agra",,,,,Scholastic Press,,2017,,Juvenile Fiction,"A powerful tale that celebrates the spirit of freedom! La Paz is a happy, but noisy village. A little peace and quiet would make it just right. So the villagers elect the bossy Don Pepe as their mayor. Before long, singing of any kind is outlawed. Even the teakettle is afraid to whistle! But there is one noisy rooster who doesn't give two mangos about this mayor's silly rules. Instead, he does what roosters were born to do. He sings: ""Kee-kee-ree-KEE!"" Carmen Deedy's masterfully crafted allegory and Eugene Yelchin's bright, whimsical mixed-media paintings celebrate the spirit of freedom - and the courage of those who are born to sing at any cost.",,,,,,,48,,,,,English,,,,9780545722889,0,0,,Unread,,,,,,,0,,,,2018/04/03 07:31:03.364815950,,,,,,adUNkAEACAAJ,,0,,
The Library Dragon,,,,,Carmen Agra Deedy,"Deedy, Carmen Agra",,,,,Peachtree,,1994,,Juvenile Fiction,"In this sequel to The Library Dragon, Miss Lotty is finally checking herself out of the Sunrise Elementary School Library, but not before Lotta Scales makes one final, fiery stand. After 557 years of faithful service, Miss Lotty is retiring from guarding books. But before she can check out of Sunrise Elementary for good, disaster strikes. Someone has ordered to have all the books removed from the library and replaced with machines! It?s enough to make Lotty feel a little?dragon-like. When she bursts into a fiery rage, only one thing can make her shed her scales: assurance that someone will fight to keep her precious books in the hands of Sunrise?s children. A surprise visit from her old friend Molly Brickmeyer reassures her that the library is safe for now and will remain a place where kids can UNPLUG, for the love of books. Carmen Agra Deedy?s timely and humorous tale is paired with Michael P. White?s lively illustrations to create an unforgettable sequel with an important message for librarians and students alike.",,,,,,,32,,,,,English,,,,9781561450916,0,0,,Unread,,,,,,,0,,,,2018/04/03 07:31:03.332780957,,,,,,rGysQgAACAAJ,,0,,
If You Give a Pig a Party,,,,,Laura Joffe Numeroff,"Numeroff, Laura Joffe",,,,,Laura Geringer Books,,2005,,Juvenile Fiction,One thing leads to another when you give a pig a party.,,,,,,,,,,,,English,,,,9780061921599,0,0,,Unread,,,,,,,0,,,,2018/04/03 07:31:03.297438979,,,,,,RDIPSQAACAAJ,,0,https://covers.openlibrary.org/b/id/8018359-L.jpg,
April Fool! watch out at school!,,Watch out at school!,,,Diane De Groat,"Groat, Diane De",,,,,HarperCollinsPublishers,,2009,,Fiction,,,,,,,,,,,,,,,,,9780061430435,0,0,,Unread,,,,,,,0,,,,2018/04/03 07:31:03.285948038,,,,,,,,0,http://images.amazon.com/images/P/0061430439.01Z.jpg,
Pete the cat and the treasure map,,,,,James Dean,"Dean, James",,,,,,,,,,,,,,,,,,,,,,,,,,9780606396240,0,0,,Unread,,,,,,,0,,,,2018/04/03 07:31:03.282678961,,,,,,,,0,http://images.amazon.com/images/P/0606396241.01Z.jpg,
Max's Easter Surprise,,,,,Rosemary Wells,"Wells, Rosemary",,,,,Penguin Group (USA) Incorporated,,2008,,Juvenile Fiction,"Ruby and her friend Louise are decorating Easter eggs, but Max wants to have an Easter Parade. Big sister Ruby tells Max that the Easter Parade is tomorrow, but that he can help today by carrying all the decorated eggs to the Easter basket. But Max doesn?t want to just carry the eggs?he wants to march them in a parade!",,,,,,,24,,,,,English,,,,9780448447834,0,0,,Unread,,,,,,,0,,,,2018/04/03 07:31:03.266545057,,,,,,iKOuPQAACAAJ,,0,,
"White Owl, Barn Owl",,,,,Nicola Davies,"Davies, Nicola",,,,,Candlewick Press,,2007,,Juvenile Fiction,"An award-winning author and illustrator swoop into the wondrous world of the barn owl.  A young girl and her grandfather look for a barn owl night after night. Will a distinctive heart-shaped face appear at the window? Michael Foreman’s lush, intimate paintings are a perfect companion to Nicola Davies’s lyrical text featuring intriguing facts about a rare bird indeed.",,,,,,,29,,,,,English,,,,9780763633646,0,0,,Unread,,,,,,,0,,,,2018/04/03 07:31:03.212890982,,,,,,kvbvAAAAMAAJ,,0,,
Dance to the Rescue (Dora the Explorer),,,,,Nickelodeon Publishing,"Publishing, Nickelodeon",,,,,Nickelodeon Publishing,2013/04/01,2013,,Juvenile Fiction,"Oh, no! A mean elf has trapped Swiper in a bottle! To save him, Dora the Explorer has to dance her way to the Castle where she can win a wish to set Swiper free. Will Dora be able to dance to Swiper's rescue?",,,,,,,13,,,,,English,,,,9781612632490,0,0,,Unread,,,,,,,0,,,,2018/03/29 12:32:08.381252050,,,,,,hK7_AgAAQBAJ,,0,,
Do Princesses Wear Hiking Boots?,,,,,Theresa Howell,"Howell, Theresa",,,,,Rising Moon,,2003,,Juvenile Fiction,"Every inquisitive little girl wonders what it is really like to be a genuine princess. At the heart ofDo Princesses Wear Hiking Boots? lives an energetic, spirited, and contemporary child who has lots of important questions for her mom. Do princesses ride tricycles, climb trees, do chores, or have to eat the crusts of their bread? The mother's voice is timelessly reassuring as she answers her daughter's questions and advises her that being like a princess has to do with what we are on the inside. This heart-warming book offers a gentle lesson about self-acceptance, and will inspire children to follow their dreams and leave their own mark on the world.",,,,,,,32,,,,,English,,,,9780873588287,0,0,,Unread,,,,,,,0,,,,2018/03/29 12:31:46.924038052,,,,,,is1W8YUKy0IC,,0,,
Pirates in Pajamas,,,,,Caroline Crowe,"Crowe, Caroline",,,,,Tiger Tales,2015/09/01,2015,,Juvenile Fiction,"The fun-loving pirates on board the Leaky Parrot love to wear pajamas! They have frilly ones and spotted ones, green ones and pink ones. These swashbucklers love to take bubble baths, dance in their pajamas, and have pillow fights. Climb on board for the most exciting pirate pajama party ever!",,,,,,,32,,,,,English,,,,9781589251908,0,0,,Unread,,,,,,,0,,,,2018/03/29 12:31:46.906713008,,,,,,Y-5nrgEACAAJ,,0,,
Bloom,,,,,Doreen Cronin,"Cronin, Doreen",,,,,Simon and Schuster,2016/02/09,2016,,Juvenile Fiction,"From #1 New York Times bestselling author Doreen Cronin and Caldecott Medal–winning illustrator David Small comes a picture book about how an extraordinary “ordinary” girl can save a kingdom with the help of a mud fairy.A glass kingdom is no place for a Mud Fairy. Bloom and her mud fairy magic might be able to turn weeds into flowers and spin sand into glass, but the people of the kingdom ceaselessly complain about the trails of dirt and puddles of mud that seem to follow her every step, and finally they cast her out. But when the glass castle begins to crack, then cracks some more, the King and Queen in a panic search for the long-banished fairy, but they can’t find Bloom anywhere. Desperate to save their home, they send their meekest, most ordinary subject, a girl named Genevievewhose sole task until now has been to polish the Queen’s crystal sugar spoon—to coax any worthy fairy to come and save the kingdom. Genevieve finds Bloom exactly where the king and queen failed to see her, and Bloom knows exactly how to save the kingdom. But it will take the two girls working together, along with a mighty dollop of self-confidence—and some very messy hands—to accomplish the extraordinary.",,,,,,,40,,,,,English,,,,9781442406209,0,0,,Unread,,,,,,,0,,,,2018/03/29 12:31:46.891178011,,,,,,Uf2BCwAAQBAJ,,0,,
